{
  "name": "file-operations",
  "version": "1.0.0",
  "description": "File system operations for AI agents",
  "author": "AgentFoundry Team",
  "platforms": ["MCP", "CLAUDE_SKILLS"],
  "permissions": [
    "file.read",
    "file.write"
  ],
  "dependencies": [],
  "tools": [
    {
      "name": "read_file",
      "description": "Read contents of a file",
      "inputSchema": {
        "type": "object",
        "properties": {
          "path": {
            "type": "string",
            "description": "File path to read"
          }
        },
        "required": ["path"]
      }
    },
    {
      "name": "write_file",
      "description": "Write content to a file",
      "inputSchema": {
        "type": "object",
        "properties": {
          "path": {
            "type": "string",
            "description": "File path to write"
          },
          "content": {
            "type": "string",
            "description": "Content to write"
          }
        },
        "required": ["path", "content"]
      }
    },
    {
      "name": "list_directory",
      "description": "List files in a directory",
      "inputSchema": {
        "type": "object",
        "properties": {
          "path": {
            "type": "string",
            "description": "Directory path to list"
          }
        },
        "required": ["path"]
      }
    }
  ]
}
